{
  "schemaVersion": 1,
  "id": "career-star-workbook-001",
  "version": 1,
  "title": "Carnet STAR",
  "summary": "La méthode STAR complétée d'un temps de réflexion, avec trois récits rédigés issus d'activités réelles du parcours — un DebugLab, un projet console, un incident simulé — et un protocole de répétition à blanc.",
  "order": 2,
  "documentPath": "STAR-WORKBOOK.md",
  "license": "CC-BY-4.0"
}
