{
  "schemaVersion": 1,
  "id": "career-negotiation-guide-001",
  "version": 1,
  "title": "Négociation de reconversion",
  "summary": "Préparer une négociation avec trois nombres écrits — plancher, fourchette de relevés datés, point d'annonce —, une liste de contreparties non salariales et des scripts de réponse aux objections classiques.",
  "order": 4,
  "documentPath": "NEGOTIATION-GUIDE.md",
  "license": "CC-BY-4.0"
}
