{
  "schemaVersion": 1,
  "id": "ai-economie-tokens-001",
  "version": 1,
  "title": "Économiser les tokens sans perdre en qualité",
  "summary": "Six techniques classées par rendement : extraits ciblés plutôt que collages, préfixe stable pour le cache, sessions closes au bon moment, grosses lectures déportées vers des sous-agents, sorties contraintes, modèle routé par tâche — et la mesure hebdomadaire.",
  "order": 2,
  "documentPath": "economie-tokens.md",
  "license": "CC-BY-4.0"
}
